{
  "type": "object",
  "properties": {
    "$schema": {
      "type": "string"
    },
    "type": {
      "const": "skeletalAnimation"
    },
    "schemaVersion": {
      "const": 1
    },
    "keyframes": {
      "type": "object",
      "additionalProperties": {
        "type": "object",
        "properties": {
          "translation": {
            "type": "array",
            "items": {
              "type": "object",
              "properties": {
                "time": {
                  "type": "number",
                  "minimum": 0
                },
                "value": {
                  "type": "array",
                  "items": {
                    "type": "number"
                  },
                  "minItems": 3,
                  "maxItems": 3
                }
              },
              "required": ["time", "value"],
              "additionalProperties": false
            },
            "minItems": 1
          },
          "rotation": {
            "type": "array",
            "items": {
              "type": "object",
              "properties": {
                "time": {
                  "type": "number",
                  "minimum": 0
                },
                "value": {
                  "type": "array",
                  "items": {
                    "type": "number"
                  },
                  "minItems": 4,
                  "maxItems": 4
                }
              },
              "required": ["time", "value"],
              "additionalProperties": false
            },
            "minItems": 1
          },
          "scale": {
            "type": "array",
            "items": {
              "type": "object",
              "properties": {
                "time": {
                  "type": "number",
                  "minimum": 0
                },
                "value": {
                  "type": "array",
                  "items": {
                    "type": "number"
                  },
                  "minItems": 3,
                  "maxItems": 3
                }
              },
              "required": ["time", "value"],
              "additionalProperties": false
            },
            "minItems": 1
          }
        },
        "required": ["translation", "rotation", "scale"],
        "additionalProperties": false
      },
      "minProperties": 1
    },
    "duration": {
      "type": "number",
      "exclusiveMinimum": 0
    },
    "playback": {
      "enum": ["loop", "once"]
    },
    "isAutoplayEnabled": {
      "type": "boolean"
    }
  },
  "required": ["type", "schemaVersion", "duration", "keyframes"],
  "$schema": "http://json-schema.org/draft-07/schema#",
  "$id": "skeletal-animation.schema.json",
  "title": "Skeletal animation",
  "additionalProperties": false
}
